{"$schema":"https://json-schema.org/draft/2020-12/schema","additionalProperties":false,"properties":{"additive_policy":{"const":"ABSENT_INSTALL_EXACT_PRESERVE_DIFFERENT_FAIL_CLOSED"},"corrected_helper":{"additionalProperties":false,"properties":{"git_blob":{"const":"64b7f56ec2425bd1c45b925aa7121f3c4866c131"},"path":{"const":"tools/hioc-pe4-ha-association-deploy.py"},"sha256":{"const":"2510f8996e80f2b779a9764bc5c685808f3f0d6ec64adc3fabbcebaf0d0e588c"}},"required":["git_blob","path","sha256"],"type":"object"},"corrected_preparation_record":{"additionalProperties":false,"properties":{"git_blob":{"const":"423d48f9532e9e7c09e4152e9946d47390a40f5d"},"path":{"const":"governance/pe4/pe4-ha-association-adapter-deployment-preparation.json"},"sha256":{"const":"744c67b9f638ed0d66c1bc9c4d9e6f81c7fea47a9ca11d4fc4ff4b6490d984d0"}},"required":["git_blob","path","sha256"],"type":"object"},"corrected_preparation_schema":{"additionalProperties":false,"properties":{"git_blob":{"const":"d1c863b93d2118556dd1ca1160da6949822d1f76"},"path":{"const":"governance/pe4/pe4-ha-association-adapter-deployment-preparation.schema.json"},"sha256":{"const":"31a5e50caadb78e79059e94547d854346458eabde92e2024f9ca497bf9cba544"}},"required":["git_blob","path","sha256"],"type":"object"},"dependency_semantics":{"additionalProperties":false,"properties":{"ABSENT":{"const":"DEPENDENCY_DRIFT"},"DIFFERENT":{"const":"DEPENDENCY_DRIFT"},"EXACT":{"const":"PRESERVE"},"INSTALL":{"const":"PROHIBITED"},"REPLACE":{"const":"PROHIBITED"}},"required":["ABSENT","DIFFERENT","EXACT","INSTALL","REPLACE"],"type":"object"},"dependency_source_identities_unchanged":{"const":true},"evidence_fields":{"items":false,"maxItems":22,"minItems":22,"prefixItems":[{"const":"TARGET"},{"const":"SOURCE_COMMIT"},{"const":"SOURCE_BINDING"},{"const":"PRODUCTION_DEPENDENCIES"},{"const":"RUNTIME_VALIDATION"},{"const":"CREDENTIAL_LOCAL_VALIDATION"},{"const":"ENDPOINT_CONFIGURATION"},{"const":"STATE_DIRECTORY_VALIDATION"},{"const":"PREEXISTING_ASSOCIATION_STATE"},{"const":"MODULE_DEPLOYMENT"},{"const":"ENTRYPOINT_DEPLOYMENT"},{"const":"RUNTIME_GOVERNANCE_DEPLOYMENT"},{"const":"SCHEDULER_PRESENT_BEFORE"},{"const":"SCHEDULER_DEPLOYMENT"},{"const":"ADAPTER_EXECUTED"},{"const":"HA_NETWORK_ATTEMPTED"},{"const":"HA_AUTHENTICATION_ATTEMPTED"},{"const":"PRODUCTION_DEPLOYMENT"},{"const":"ROLLBACK"},{"const":"RESULT"},{"const":"ERROR_CODE"},{"const":"DEPLOYMENT_TRANSACTION"}],"type":"array"},"historical_preparation_commit":{"const":"0040bdc79e66c10db4f180f952d04f97b1070065"},"historical_preparation_record":{"additionalProperties":false,"properties":{"git_blob":{"const":"5fd5be4f7b04afc3a0230c7cf83411ad41bac198"},"path":{"const":"governance/pe4/pe4-ha-association-adapter-deployment-preparation.json"},"sha256":{"const":"269a33072db69177a5218afa2a129535a346d316b3341b9363b5ba0f2d9f3c67"}},"required":["git_blob","path","sha256"],"type":"object"},"historical_preparation_schema":{"additionalProperties":false,"properties":{"git_blob":{"const":"de646836ded14fc2a04683242bf37f86e4e9c9d5"},"path":{"const":"governance/pe4/pe4-ha-association-adapter-deployment-preparation.schema.json"},"sha256":{"const":"580bb21f77558f3214dcccd99275bbcf1118827bcaea4d2b86e1d3bddce3342b"}},"required":["git_blob","path","sha256"],"type":"object"},"lifecycle":{"additionalProperties":false,"properties":{"adapter_implementation":{"const":"PASS_CLOSED_CORRECTED_BEFORE_DEPLOYMENT"},"bounded_manual_production_validation":{"const":"NOT_STARTED"},"deployment":{"const":"NOT_STARTED"},"deployment_preparation":{"const":"PASS_CLOSED_CORRECTED_BEFORE_EXECUTION"},"independent_production_acceptance":{"const":"NOT_STARTED"},"pe4":{"const":"NOT_COMPLETE"},"phase7a":{"const":"ACTIVE"},"public_projection":{"const":"DEFERRED"},"rollback":{"const":"NOT_PERFORMED"},"scheduler_deployment":{"const":"NOT_STARTED"}},"required":["adapter_implementation","bounded_manual_production_validation","deployment","deployment_preparation","independent_production_acceptance","pe4","phase7a","public_projection","rollback","scheduler_deployment"],"type":"object"},"negative_evidence":{"additionalProperties":false,"properties":{"adapter_execution":{"const":false},"adapter_network_execution":{"const":false},"deployment":{"const":false},"ha_access":{"const":false},"mqtt":{"const":false},"pi3_access":{"const":false},"pi5_access":{"const":false},"production_mutation":{"const":false},"public_projection":{"const":false},"real_credential_access":{"const":false},"rollback":{"const":false},"scheduler_activation":{"const":false}},"required":["adapter_execution","adapter_network_execution","deployment","ha_access","mqtt","pi3_access","pi5_access","production_mutation","public_projection","real_credential_access","rollback","scheduler_activation"],"type":"object"},"next_checkpoint":{"const":"PE-4 Home Assistant Association Adapter Deployment Execution"},"postcommit_failure":{"additionalProperties":false,"properties":{"DEPLOYMENT_TRANSACTION":{"const":"COMMITTED"},"PRODUCTION_DEPLOYMENT":{"const":"PASS"},"RESULT":{"const":"FAIL"},"automatic_rollback":{"const":false}},"required":["DEPLOYMENT_TRANSACTION","PRODUCTION_DEPLOYMENT","RESULT","automatic_rollback"],"type":"object"},"production_deployment_mapping":{"additionalProperties":false,"properties":{"COMMITTED":{"const":"PASS"},"NOT_STARTED":{"const":"NOT_STARTED"},"PREPARED":{"const":"INCOMPLETE"}},"required":["COMMITTED","NOT_STARTED","PREPARED"],"type":"object"},"record_type":{"const":"PE4_HA_ASSOCIATION_ADAPTER_DEPLOYMENT_PREPARATION_CORRECTION"},"required_existing_dependency_policy":{"const":"REQUIRED_EXISTING_EXACT_PRESERVE_ABSENT_OR_DIFFERENT_FAIL_CLOSED"},"status":{"const":"PASS_CLOSED"},"transaction_authority":{"const":"READ_ONLY_SECURED_BOUNDED_VALID_CANONICAL_INTENT_AND_SOURCE_BOUND_COMMITTED_MARKER"},"transaction_states":{"items":false,"maxItems":3,"minItems":3,"prefixItems":[{"const":"NOT_STARTED"},{"const":"PREPARED"},{"const":"COMMITTED"}],"type":"array"},"validation":{"additionalProperties":false,"properties":{"adapter_tests":{"const":70},"focused_tests":{"const":72},"new_correction_tests":{"const":22},"other_regression_tests":{"const":275},"skip_reason":{"const":"Existing release rsync unavailable on Windows"},"total_passed":{"const":416},"total_run":{"const":417},"total_skipped":{"const":1}},"required":["adapter_tests","focused_tests","new_correction_tests","other_regression_tests","skip_reason","total_passed","total_run","total_skipped"],"type":"object"}},"required":["additive_policy","corrected_helper","corrected_preparation_record","corrected_preparation_schema","dependency_semantics","dependency_source_identities_unchanged","evidence_fields","historical_preparation_commit","historical_preparation_record","historical_preparation_schema","lifecycle","negative_evidence","next_checkpoint","postcommit_failure","production_deployment_mapping","record_type","required_existing_dependency_policy","status","transaction_authority","transaction_states","validation"],"title":"Closed PE-4 Association Deployment Preparation Pre-execution Correction","type":"object"}
