{"additive_policy":"ABSENT_INSTALL_EXACT_PRESERVE_DIFFERENT_FAIL_CLOSED","corrected_helper":{"git_blob":"64b7f56ec2425bd1c45b925aa7121f3c4866c131","path":"tools/hioc-pe4-ha-association-deploy.py","sha256":"2510f8996e80f2b779a9764bc5c685808f3f0d6ec64adc3fabbcebaf0d0e588c"},"corrected_preparation_record":{"git_blob":"423d48f9532e9e7c09e4152e9946d47390a40f5d","path":"governance/pe4/pe4-ha-association-adapter-deployment-preparation.json","sha256":"744c67b9f638ed0d66c1bc9c4d9e6f81c7fea47a9ca11d4fc4ff4b6490d984d0"},"corrected_preparation_schema":{"git_blob":"d1c863b93d2118556dd1ca1160da6949822d1f76","path":"governance/pe4/pe4-ha-association-adapter-deployment-preparation.schema.json","sha256":"31a5e50caadb78e79059e94547d854346458eabde92e2024f9ca497bf9cba544"},"dependency_semantics":{"ABSENT":"DEPENDENCY_DRIFT","DIFFERENT":"DEPENDENCY_DRIFT","EXACT":"PRESERVE","INSTALL":"PROHIBITED","REPLACE":"PROHIBITED"},"dependency_source_identities_unchanged":true,"evidence_fields":["TARGET","SOURCE_COMMIT","SOURCE_BINDING","PRODUCTION_DEPENDENCIES","RUNTIME_VALIDATION","CREDENTIAL_LOCAL_VALIDATION","ENDPOINT_CONFIGURATION","STATE_DIRECTORY_VALIDATION","PREEXISTING_ASSOCIATION_STATE","MODULE_DEPLOYMENT","ENTRYPOINT_DEPLOYMENT","RUNTIME_GOVERNANCE_DEPLOYMENT","SCHEDULER_PRESENT_BEFORE","SCHEDULER_DEPLOYMENT","ADAPTER_EXECUTED","HA_NETWORK_ATTEMPTED","HA_AUTHENTICATION_ATTEMPTED","PRODUCTION_DEPLOYMENT","ROLLBACK","RESULT","ERROR_CODE","DEPLOYMENT_TRANSACTION"],"historical_preparation_commit":"0040bdc79e66c10db4f180f952d04f97b1070065","historical_preparation_record":{"git_blob":"5fd5be4f7b04afc3a0230c7cf83411ad41bac198","path":"governance/pe4/pe4-ha-association-adapter-deployment-preparation.json","sha256":"269a33072db69177a5218afa2a129535a346d316b3341b9363b5ba0f2d9f3c67"},"historical_preparation_schema":{"git_blob":"de646836ded14fc2a04683242bf37f86e4e9c9d5","path":"governance/pe4/pe4-ha-association-adapter-deployment-preparation.schema.json","sha256":"580bb21f77558f3214dcccd99275bbcf1118827bcaea4d2b86e1d3bddce3342b"},"lifecycle":{"adapter_implementation":"PASS_CLOSED_CORRECTED_BEFORE_DEPLOYMENT","bounded_manual_production_validation":"NOT_STARTED","deployment":"NOT_STARTED","deployment_preparation":"PASS_CLOSED_CORRECTED_BEFORE_EXECUTION","independent_production_acceptance":"NOT_STARTED","pe4":"NOT_COMPLETE","phase7a":"ACTIVE","public_projection":"DEFERRED","rollback":"NOT_PERFORMED","scheduler_deployment":"NOT_STARTED"},"negative_evidence":{"adapter_execution":false,"adapter_network_execution":false,"deployment":false,"ha_access":false,"mqtt":false,"pi3_access":false,"pi5_access":false,"production_mutation":false,"public_projection":false,"real_credential_access":false,"rollback":false,"scheduler_activation":false},"next_checkpoint":"PE-4 Home Assistant Association Adapter Deployment Execution","postcommit_failure":{"DEPLOYMENT_TRANSACTION":"COMMITTED","PRODUCTION_DEPLOYMENT":"PASS","RESULT":"FAIL","automatic_rollback":false},"production_deployment_mapping":{"COMMITTED":"PASS","NOT_STARTED":"NOT_STARTED","PREPARED":"INCOMPLETE"},"record_type":"PE4_HA_ASSOCIATION_ADAPTER_DEPLOYMENT_PREPARATION_CORRECTION","required_existing_dependency_policy":"REQUIRED_EXISTING_EXACT_PRESERVE_ABSENT_OR_DIFFERENT_FAIL_CLOSED","status":"PASS_CLOSED","transaction_authority":"READ_ONLY_SECURED_BOUNDED_VALID_CANONICAL_INTENT_AND_SOURCE_BOUND_COMMITTED_MARKER","transaction_states":["NOT_STARTED","PREPARED","COMMITTED"],"validation":{"adapter_tests":70,"focused_tests":72,"new_correction_tests":22,"other_regression_tests":275,"skip_reason":"Existing release rsync unavailable on Windows","total_passed":416,"total_run":417,"total_skipped":1}}
